{
  "schema_version": "1.0",
  "metadata": { "name": "demo flow", "version": 1, "created_at": "2026-10-09T00:00:00Z" },
  "nodes": [
    {
      "id": "n_start",
      "type": "start",
      "label": "Start",
      "position": { "x": 0, "y": 0 },
      "config": {}
    },
    {
      "id": "n_agent",
      "type": "agent",
      "label": "Agent",
      "position": { "x": 100, "y": 0 },
      "config": {
        "agent_definition_id": "11111111-1111-4111-8111-111111111111",
        "model_profile_id": "22222222-2222-4222-8222-222222222222",
        "tool_policy_id": "33333333-3333-4333-8333-333333333333"
      }
    },
    {
      "id": "n_end",
      "type": "end",
      "label": "End",
      "position": { "x": 200, "y": 0 },
      "config": {}
    }
  ],
  "edges": [
    { "id": "e1", "source_node_id": "n_start", "target_node_id": "n_agent", "output_mapping": {}, "on_error": "fail", "max_retries": 0 },
    { "id": "e2", "source_node_id": "n_agent", "target_node_id": "n_end", "output_mapping": {}, "on_error": "fail", "max_retries": 0 }
  ]
}